period_date,filing_date,type,form_name,documents,text,part.name,item.name,section
2019-03-31T04:00:00Z,2019-05-02T04:00:00Z,10-Q,Quarterly report [Sections 13 or 15(d)],85,"Net charges in first quarter 2019 were $726 million, compared with $442 million a year earlier. The change between periods was mainly due to higher corporate charges and higher interest expenses. Foreign currency effects decreased net charges by $2 million between the periods.",PART I,Item 2. Management's Discussion and Analysis of Financial Condition and Results of Operations,discussion
2019-03-31T04:00:00Z,2019-05-02T04:00:00Z,10-Q,Quarterly report [Sections 13 or 15(d)],85,31,PART I,Item 2. Management's Discussion and Analysis of Financial Condition and Results of Operations,discussion
2019-03-31T04:00:00Z,2019-05-02T04:00:00Z,10-Q,Quarterly report [Sections 13 or 15(d)],85,Table of Contents,PART I,Item 2. Management's Discussion and Analysis of Financial Condition and Results of Operations,discussion
2019-03-31T04:00:00Z,2019-05-02T04:00:00Z,10-Q,Quarterly report [Sections 13 or 15(d)],85,Consolidated Statement of Income,PART I,Item 2. Management's Discussion and Analysis of Financial Condition and Results of Operations,discussion
2019-03-31T04:00:00Z,2019-05-02T04:00:00Z,10-Q,Quarterly report [Sections 13 or 15(d)],85,Explanations of variations between periods for selected income statement categories are provided below:,PART I,Item 2. Management's Discussion and Analysis of Financial Condition and Results of Operations,discussion
2019-03-31T04:00:00Z,2019-05-02T04:00:00Z,10-Q,Quarterly report [Sections 13 or 15(d)],85,"Three Months Ended  March 31   2019   2018   (Millions of dollars) Sales and other operating revenues $ 34,189     $ 35,968",PART I,Item 2. Management's Discussion and Analysis of Financial Condition and Results of Operations,discussion
2019-03-31T04:00:00Z,2019-05-02T04:00:00Z,10-Q,Quarterly report [Sections 13 or 15(d)],85,"Sales and other operating revenues decreased $1.78 billion in the first quarter, primarily due to lower refined product and crude oil prices, partially offset by higher natural gas volumes.",PART I,Item 2. Management's Discussion and Analysis of Financial Condition and Results of Operations,discussion
2019-03-31T04:00:00Z,2019-05-02T04:00:00Z,10-Q,Quarterly report [Sections 13 or 15(d)],85,"Three Months Ended  March 31   2019   2018   (Millions of dollars) Income from equity affiliates $ 1,062     $ 1,637",PART I,Item 2. Management's Discussion and Analysis of Financial Condition and Results of Operations,discussion
2019-03-31T04:00:00Z,2019-05-02T04:00:00Z,10-Q,Quarterly report [Sections 13 or 15(d)],85,Income from equity affiliates in the quarterly period decreased mainly due to lower upstream-related earnings from Petropiar and Petroboscan in Venezuela.,PART I,Item 2. Management's Discussion and Analysis of Financial Condition and Results of Operations,discussion
2019-03-31T04:00:00Z,2019-05-02T04:00:00Z,10-Q,Quarterly report [Sections 13 or 15(d)],85,Three Months Ended  March 31   2019   2018   (Millions of dollars) Other income (loss) $ (51 )   $ 159,PART I,Item 2. Management's Discussion and Analysis of Financial Condition and Results of Operations,discussion
2019-03-31T04:00:00Z,2019-05-02T04:00:00Z,10-Q,Quarterly report [Sections 13 or 15(d)],85,Other income for the three-month period decreased due to lower earnings from asset sales and unfavorable swings in foreign currency effects.,PART I,Item 2. Management's Discussion and Analysis of Financial Condition and Results of Operations,discussion
2019-03-31T04:00:00Z,2019-05-02T04:00:00Z,10-Q,Quarterly report [Sections 13 or 15(d)],85,"Three Months Ended  March 31   2019   2018   (Millions of dollars) Purchased crude oil and products $ 19,703     $ 21,233",PART I,Item 2. Management's Discussion and Analysis of Financial Condition and Results of Operations,discussion
2019-03-31T04:00:00Z,2019-05-02T04:00:00Z,10-Q,Quarterly report [Sections 13 or 15(d)],85,"Purchases decreased $1.5 billion in the three-month period, primarily due to lower crude oil purchase volumes and lower refined product prices.",PART I,Item 2. Management's Discussion and Analysis of Financial Condition and Results of Operations,discussion
2019-03-31T04:00:00Z,2019-05-02T04:00:00Z,10-Q,Quarterly report [Sections 13 or 15(d)],85,"Three Months Ended  March 31   2019   2018   (Millions of dollars) Operating, selling, general and administrative expenses $ 5,870     $ 5,424",PART I,Item 2. Management's Discussion and Analysis of Financial Condition and Results of Operations,discussion
2019-03-31T04:00:00Z,2019-05-02T04:00:00Z,10-Q,Quarterly report [Sections 13 or 15(d)],85,"Operating, selling, general and administrative expenses increased between quarterly periods primarily due to higher employee and transportation expenses.",PART I,Item 2. Management's Discussion and Analysis of Financial Condition and Results of Operations,discussion
2019-03-31T04:00:00Z,2019-05-02T04:00:00Z,10-Q,Quarterly report [Sections 13 or 15(d)],85,Three Months Ended  March 31   2019   2018   (Millions of dollars) Exploration expenses $ 189     $ 158,PART I,Item 2. Management's Discussion and Analysis of Financial Condition and Results of Operations,discussion
2019-03-31T04:00:00Z,2019-05-02T04:00:00Z,10-Q,Quarterly report [Sections 13 or 15(d)],85,The increase in exploration expenses for the three-month period was mostly due to higher charges for well write-offs.,PART I,Item 2. Management's Discussion and Analysis of Financial Condition and Results of Operations,discussion
2019-03-31T04:00:00Z,2019-05-02T04:00:00Z,10-Q,Quarterly report [Sections 13 or 15(d)],85,32,PART I,Item 2. Management's Discussion and Analysis of Financial Condition and Results of Operations,discussion
2019-03-31T04:00:00Z,2019-05-02T04:00:00Z,10-Q,Quarterly report [Sections 13 or 15(d)],85,Table of Contents,PART I,Item 2. Management's Discussion and Analysis of Financial Condition and Results of Operations,discussion
2019-03-31T04:00:00Z,2019-05-02T04:00:00Z,10-Q,Quarterly report [Sections 13 or 15(d)],85,"Three Months Ended  March 31   2019   2018   (Millions of dollars) Depreciation, depletion and amortization $ 4,094     $ 4,289",PART I,Item 2. Management's Discussion and Analysis of Financial Condition and Results of Operations,discussion
2019-03-31T04:00:00Z,2019-05-02T04:00:00Z,10-Q,Quarterly report [Sections 13 or 15(d)],85,"Depreciation, depletion and amortization expenses for the first quarter decreased mainly due to lower rates and lower impairments, partially offset by higher production.",PART I,Item 2. Management's Discussion and Analysis of Financial Condition and Results of Operations,discussion
2019-03-31T04:00:00Z,2019-05-02T04:00:00Z,10-Q,Quarterly report [Sections 13 or 15(d)],85,"Three Months Ended  March 31   2019   2018   (Millions of dollars) Taxes other than on income $ 1,061     $ 1,344",PART I,Item 2. Management's Discussion and Analysis of Financial Condition and Results of Operations,discussion
2019-03-31T04:00:00Z,2019-05-02T04:00:00Z,10-Q,Quarterly report [Sections 13 or 15(d)],85,Taxes other than on income were lower mainly due to lower local and municipal taxes and licenses as a result of the company's divestment of its downstream interests in southern Africa in third quarter 2018.,PART I,Item 2. Management's Discussion and Analysis of Financial Condition and Results of Operations,discussion
2019-03-31T04:00:00Z,2019-05-02T04:00:00Z,10-Q,Quarterly report [Sections 13 or 15(d)],85,Three Months Ended  March 31   2019   2018   (Millions of dollars) Interest and debt expense $ 225     $ 159,PART I,Item 2. Management's Discussion and Analysis of Financial Condition and Results of Operations,discussion
2019-03-31T04:00:00Z,2019-05-02T04:00:00Z,10-Q,Quarterly report [Sections 13 or 15(d)],85,Interest and debt expenses for the first quarter increased mainly due to a decrease in the amount of interest capitalized.,PART I,Item 2. Management's Discussion and Analysis of Financial Condition and Results of Operations,discussion
2019-03-31T04:00:00Z,2019-05-02T04:00:00Z,10-Q,Quarterly report [Sections 13 or 15(d)],85,Three Months Ended  March 31   2019   2018   (Millions of dollars) Other components of net periodic benefit costs $ 101     $ 84,PART I,Item 2. Management's Discussion and Analysis of Financial Condition and Results of Operations,discussion
2019-03-31T04:00:00Z,2019-05-02T04:00:00Z,10-Q,Quarterly report [Sections 13 or 15(d)],85,"Other components of net periodic benefit costs for the first quarter increased mainly due to lower plan assets and increases in interest expense, partially offset by a decrease in the amortization of actuarial losses.",PART I,Item 2. Management's Discussion and Analysis of Financial Condition and Results of Operations,discussion
2019-03-31T04:00:00Z,2019-05-02T04:00:00Z,10-Q,Quarterly report [Sections 13 or 15(d)],85,"Three Months Ended  March 31   2019   2018   (Millions of dollars) Income tax expense $ 1,315     $ 1,414",PART I,Item 2. Management's Discussion and Analysis of Financial Condition and Results of Operations,discussion
2019-03-31T04:00:00Z,2019-05-02T04:00:00Z,10-Q,Quarterly report [Sections 13 or 15(d)],85,The decrease in income tax expense in 2019 of $99 million is consistent with the decrease in total income before tax for the company of $1.12 billion and changes in jurisdictional mix effects between periods.,PART I,Item 2. Management's Discussion and Analysis of Financial Condition and Results of Operations,discussion
2019-03-31T04:00:00Z,2019-05-02T04:00:00Z,10-Q,Quarterly report [Sections 13 or 15(d)],85,"U.S. income before tax decreased from $862 million in 2018 to $370 million in 2019. This decrease in income was primarily driven by the effect of lower crude oil and natural gas prices. The decrease in income had a direct impact on the company's U.S. income tax cost.  This resulted in a decrease in tax expense of $81 million between year-over-year periods, from $221 million in 2018 to $140 million in 2019.",PART I,Item 2. Management's Discussion and Analysis of Financial Condition and Results of Operations,discussion
2019-03-31T04:00:00Z,2019-05-02T04:00:00Z,10-Q,Quarterly report [Sections 13 or 15(d)],85,"International income before tax decreased from $4.21 billion in 2018 to $3.59 billion in 2019. This $624 million decrease was primarily driven by the effect of lower crude oil prices, partially offset by higher natural gas volumes and prices. The decrease in income and jurisdictional mix effects resulted in an $18 million decrease in international income tax expense between year-over-year periods, from $1.19 billion in 2018 to $1.17 billion in 2019.",PART I,Item 2. Management's Discussion and Analysis of Financial Condition and Results of Operations,discussion
2019-03-31T04:00:00Z,2019-05-02T04:00:00Z,10-Q,Quarterly report [Sections 13 or 15(d)],85,Refer also to the discussion of the effective income tax rate in Note 11 on page 17.,PART I,Item 2. Management's Discussion and Analysis of Financial Condition and Results of Operations,discussion
2019-03-31T04:00:00Z,2019-05-02T04:00:00Z,10-Q,Quarterly report [Sections 13 or 15(d)],85,33,PART I,Item 2. Management's Discussion and Analysis of Financial Condition and Results of Operations,discussion
2019-03-31T04:00:00Z,2019-05-02T04:00:00Z,10-Q,Quarterly report [Sections 13 or 15(d)],85,Table of Contents,PART I,Item 2. Management's Discussion and Analysis of Financial Condition and Results of Operations,discussion
2019-03-31T04:00:00Z,2019-05-02T04:00:00Z,10-Q,Quarterly report [Sections 13 or 15(d)],85,Selected Operating Data,PART I,Item 2. Management's Discussion and Analysis of Financial Condition and Results of Operations,discussion
2019-03-31T04:00:00Z,2019-05-02T04:00:00Z,10-Q,Quarterly report [Sections 13 or 15(d)],85,The following table presents a comparison of selected operating data:,PART I,Item 2. Management's Discussion and Analysis of Financial Condition and Results of Operations,discussion
2019-03-31T04:00:00Z,2019-05-02T04:00:00Z,10-Q,Quarterly report [Sections 13 or 15(d)],85,"Selected Operating Data (1) (2)   Three Months Ended  March 31   2019   2018 U.S. Upstream       Net crude oil and natural gas liquids production (MBPD) 690     567   Net natural gas production (MMCFPD)(3) 1,162     993   Net oil-equivalent production (MBOEPD) 884     733   Sales of natural gas (MMCFPD) 4,255     3,408   Sales of natural gas liquids (MBPD) 110     100   Revenue from net production       Liquids ($/Bbl) $ 48.46     $ 56.12   Natural gas ($/MCF) $ 1.64     $ 2.02   International Upstream       Net crude oil and natural gas liquids production (MBPD)(4) 1,185     1,186   Net natural gas production (MMCFPD)(3) 5,813     5,600   Net oil-equivalent production (MBOEPD)(4) 2,154     2,119   Sales of natural gas (MMCFPD) 5,836     5,475   Sales of natural gas liquids (MBPD) 38     35   Revenue from liftings       Liquids ($/Bbl) $ 57.99     $ 61.13   Natural gas ($/MCF) $ 6.57     $ 5.85   U.S. and International Upstream       Total net oil-equivalent production (MBOEPD)(4) 3,038     2,852   U.S. Downstream       Gasoline sales (MBPD)(5) 619     601   Other refined product sales (MBPD) 572     584   Total refined product sales (MBPD) 1,191     1,185   Sales of natural gas liquids (MBPD) 91     55   Refinery input (MBPD) 861     930   International Downstream       Gasoline sales (MBPD)(5) 262     332   Other refined product sales (MBPD) 762     743   Share of affiliate sales (MBPD) 391     361   Total refined product sales (MBPD) 1,415     1,436   Sales of natural gas liquids (MBPD) 74     60   Refinery input (MBPD) 669     712   ________________________________       (1)  Includes company share of equity affiliates.       (2)  MBPD  -  thousands of barrels per day; MMCFPD  -  millions of cubic feet per day; Bbl  -  Barrel; MCF  -  thousands of cubic feet; oil-equivalent gas conversion ratio is 6,000 cubic feet of natural gas = 1 barrel of crude oil; MBOEPD  -  thousands of barrels of oil-equivalent per day. (3)  Includes natural gas consumed in operations (MMCFPD):       United States 38     37   International 607     572   (4)  Includes net production of synthetic oil:       Canada 50     55   Venezuela affiliate 23     24   (5)  Includes branded and unbranded gasoline.",PART I,Item 2. Management's Discussion and Analysis of Financial Condition and Results of Operations,discussion
2019-03-31T04:00:00Z,2019-05-02T04:00:00Z,10-Q,Quarterly report [Sections 13 or 15(d)],85,34,PART I,Item 2. Management's Discussion and Analysis of Financial Condition and Results of Operations,discussion
2019-03-31T04:00:00Z,2019-05-02T04:00:00Z,10-Q,Quarterly report [Sections 13 or 15(d)],85,Table of Contents,PART I,Item 2. Management's Discussion and Analysis of Financial Condition and Results of Operations,discussion
2019-03-31T04:00:00Z,2019-05-02T04:00:00Z,10-Q,Quarterly report [Sections 13 or 15(d)],85,Liquidity and Capital Resources,PART I,Item 2. Management's Discussion and Analysis of Financial Condition and Results of Operations,discussion
2019-03-31T04:00:00Z,2019-05-02T04:00:00Z,10-Q,Quarterly report [Sections 13 or 15(d)],85,"Cash, cash equivalents and marketable securities totaled $8.8 billion at March 31, 2019 and $10.3 billion at year-end 2018. Cash provided by operating activities in the first three months of 2019 was $5.1 billion, compared with $5.0 billion in the year-ago period. Cash capital and exploratory expenditures totaled $3.2 billion in the first three months of 2019, up $92 million from the year-ago period. Proceeds and deposits related to asset sales and returns of investment totaled $276 million and $18 million, respectively, in the first three months of 2019, compared to $31 million and $80 million, respectively, in the year ago period. The company intends to fund the cash portion of the Anadarko acquisition using a combination of cash on hand and borrowings under its commercial paper program.",PART I,Item 2. Management's Discussion and Analysis of Financial Condition and Results of Operations,discussion
2019-03-31T04:00:00Z,2019-05-02T04:00:00Z,10-Q,Quarterly report [Sections 13 or 15(d)],85,"Dividends The company paid dividends of $2.2 billion to common stockholders during the first three months of 2019. In April 2019, the company declared a quarterly dividend of $1.19 per common share, payable in June 2019.",PART I,Item 2. Management's Discussion and Analysis of Financial Condition and Results of Operations,discussion
2019-03-31T04:00:00Z,2019-05-02T04:00:00Z,10-Q,Quarterly report [Sections 13 or 15(d)],85,"Debt and Finance Lease Obligations Chevron's total debt and finance lease obligations were $33.1 billion at March 31, 2019, down from $34.5 billion at December 31, 2018.",PART I,Item 2. Management's Discussion and Analysis of Financial Condition and Results of Operations,discussion
2019-03-31T04:00:00Z,2019-05-02T04:00:00Z,10-Q,Quarterly report [Sections 13 or 15(d)],85,"The company's primary financing source for working capital needs is its commercial paper program. The outstanding balance for the company's commercial paper program at March 31, 2019 was $8.5 billion. The company's debt and capital lease obligations due within one year, consisting primarily of commercial paper, redeemable long-term obligations and the current portion of long-term debt, totaled $16.9 billion at March 31, 2019, and $15.6 billion at December 31, 2018. Of these amounts, $9.9 billion was reclassified to long-term at both March 31, 2019, and December 31, 2018. At March 31, 2019, settlement of these obligations was not expected to require the use of working capital within one year, as the company had the intent and the ability, as evidenced by committed credit facilities, to refinance them on a long-term basis.",PART I,Item 2. Management's Discussion and Analysis of Financial Condition and Results of Operations,discussion
2019-03-31T04:00:00Z,2019-05-02T04:00:00Z,10-Q,Quarterly report [Sections 13 or 15(d)],85,"At March 31, 2019, the company had $9.9 billion in committed credit facilities with various major banks that enable the refinancing of short-term obligations on a long-term basis. The credit facilities consist of a 364-day facility which enables borrowing of up to $9,575 million and allows the company to convert any amounts outstanding into a term loan for a period of up to one year, as well as a $325 million five-year facility expiring in December 2020. These facilities support commercial paper borrowing and can also be used for general corporate purposes. The company's practice has been to continually replace expiring commitments with new commitments on substantially the same terms, maintaining levels management believes appropriate. Any borrowings under the facilities would be unsecured indebtedness at interest rates based on the London Interbank Offered Rate or an average of base lending rates published by specified banks and on terms reflecting the company's strong credit rating. No borrowings were outstanding under these facilities at March 31, 2019. In addition, the company has an automatic shelf registration statement that expires in May 2021 for an unspecified amount of nonconvertible debt securities issued or guaranteed by the company.",PART I,Item 2. Management's Discussion and Analysis of Financial Condition and Results of Operations,discussion
2019-03-31T04:00:00Z,2019-05-02T04:00:00Z,10-Q,Quarterly report [Sections 13 or 15(d)],85,"The major debt rating agencies routinely evaluate the company's debt, and the company's cost of borrowing can increase or decrease depending on these debt ratings. The company has outstanding public bonds issued by Chevron Corporation and Texaco Capital Inc. All of these securities are the obligations of, or guaranteed by, Chevron Corporation and are rated AA by Standard and Poor's Corporation and Aa2 by Moody's Investors Service. The company's U.S. commercial paper is rated A-1+ by Standard and Poor's and P-1 by Moody's. All of these ratings denote high-quality, investment-grade securities.",PART I,Item 2. Management's Discussion and Analysis of Financial Condition and Results of Operations,discussion
2019-03-31T04:00:00Z,2019-05-02T04:00:00Z,10-Q,Quarterly report [Sections 13 or 15(d)],85,"The company's future debt level is dependent primarily on results of operations, the capital program, acquisitions and cash that may be generated from asset dispositions. Based on its high-quality debt ratings, the company believes that it has substantial borrowing capacity to meet unanticipated cash requirements. During extended periods of low prices for crude oil and natural gas and narrow margins for refined products and commodity chemicals, the company can also modify capital spending plans to provide flexibility to continue paying the common stock dividend and also remain committed to retaining the company's high-quality debt ratings.",PART I,Item 2. Management's Discussion and Analysis of Financial Condition and Results of Operations,discussion
2019-03-31T04:00:00Z,2019-05-02T04:00:00Z,10-Q,Quarterly report [Sections 13 or 15(d)],85,"Common Stock Repurchase Program In July 2010, the Board of Directors approved an ongoing stock repurchase program with no set term or monetary limits. From the inception of the program through the end of January 2019, the company had purchased 198.9 million shares for $22.1 billion. On February 1, 2019, the company announced that the Board of Directors authorized a new stock repurchase program with a maximum dollar limit of $25 billion and no set term limits. As of March 31, 2019, under the new program, the company had purchased",PART I,Item 2. Management's Discussion and Analysis of Financial Condition and Results of Operations,discussion
2019-03-31T04:00:00Z,2019-05-02T04:00:00Z,10-Q,Quarterly report [Sections 13 or 15(d)],85,35,PART I,Item 2. Management's Discussion and Analysis of Financial Condition and Results of Operations,discussion
2019-03-31T04:00:00Z,2019-05-02T04:00:00Z,10-Q,Quarterly report [Sections 13 or 15(d)],85,Table of Contents,PART I,Item 2. Management's Discussion and Analysis of Financial Condition and Results of Operations,discussion
2019-03-31T04:00:00Z,2019-05-02T04:00:00Z,10-Q,Quarterly report [Sections 13 or 15(d)],85,"1.5 million shares for $183 million, resulting in $24.8 billion remaining under the authorized program. During the first quarter 2019, the company purchased a total of 4.7 million shares for $537 million. Repurchases may be made from time to time in the open market, by block purchases, in privately negotiated transactions or in such other manner as determined by the company. The timing of the repurchases and the actual amount repurchased will depend on a variety of factors, including the market price of the company's shares, general market and economic conditions, and other factors. The stock repurchase program does not obligate the company to acquire any particular amount of common stock, and it may be suspended or discontinued at any time.",PART I,Item 2. Management's Discussion and Analysis of Financial Condition and Results of Operations,discussion
2019-03-31T04:00:00Z,2019-05-02T04:00:00Z,10-Q,Quarterly report [Sections 13 or 15(d)],85,"Noncontrolling Interests The company had noncontrolling interests of $1.1 billion at March 31, 2019 and at December 31, 2018. There were distributions of $6 million to noncontrolling interests during the first three months of 2019 compared to $11 million for the same period in 2018.",PART I,Item 2. Management's Discussion and Analysis of Financial Condition and Results of Operations,discussion
2019-03-31T04:00:00Z,2019-05-02T04:00:00Z,10-Q,Quarterly report [Sections 13 or 15(d)],85,"Current Ratio Current assets divided by current liabilities, which indicates the company's ability to repay its short-term liabilities with short-term assets. The current ratio was 1.1 at March 31, 2019, and 1.3 at December 31, 2018. The current ratio is adversely affected by the fact that Chevron's inventories are valued on a last-in, first-out basis. At March 31, 2019, the book value of inventory was lower than replacement cost.",PART I,Item 2. Management's Discussion and Analysis of Financial Condition and Results of Operations,discussion
2019-03-31T04:00:00Z,2019-05-02T04:00:00Z,10-Q,Quarterly report [Sections 13 or 15(d)],85,"Debt Ratio Total debt as a percentage of total debt plus Chevron Corporation Stockholders' Equity, which indicates the company's leverage, was 17.6 percent at March 31, 2019, and 18.2 percent at December 31, 2018.",PART I,Item 2. Management's Discussion and Analysis of Financial Condition and Results of Operations,discussion
2019-03-31T04:00:00Z,2019-05-02T04:00:00Z,10-Q,Quarterly report [Sections 13 or 15(d)],85,Pension Obligations Information related to pension plan contributions is included on page 14  in Note 9 to the Consolidated Financial Statements.,PART I,Item 2. Management's Discussion and Analysis of Financial Condition and Results of Operations,discussion
2019-03-31T04:00:00Z,2019-05-02T04:00:00Z,10-Q,Quarterly report [Sections 13 or 15(d)],85,"Capital and Exploratory Expenditures Total expenditures, including the company's share of spending by affiliates, were $4.7 billion in the first three months of 2019, compared with $4.4 billion in the corresponding 2018 period. The amounts included the company's share of affiliates' expenditures of $1.5 billion and $1.3 billion in the 2019 and 2018 periods, respectively, which did not require cash outlays by the company. Expenditures for upstream projects in the first three months of 2019 were $4.2 billion, representing 89 percent of the companywide total.",PART I,Item 2. Management's Discussion and Analysis of Financial Condition and Results of Operations,discussion
