period_date,filing_date,type,form_name,documents,text,part.name,item.name,section
2018-09-30T04:00:00Z,2018-11-08T05:00:00Z,10-Q,Quarterly report [Sections 13 or 15(d)],83,"Net charges for the first nine months of 2018 were $1.87 billion, compared with $710 million a year earlier. The change between periods was mainly due higher tax items and interest expense, partially offset by lower employee expense. Foreign currency effects increased net charges by $117 million between periods.",PART I,Item 2. Management's Discussion and Analysis of Financial Condition and Results of Operations,discussion
2018-09-30T04:00:00Z,2018-11-08T05:00:00Z,10-Q,Quarterly report [Sections 13 or 15(d)],83,32,PART I,Item 2. Management's Discussion and Analysis of Financial Condition and Results of Operations,discussion
2018-09-30T04:00:00Z,2018-11-08T05:00:00Z,10-Q,Quarterly report [Sections 13 or 15(d)],83,Table of Contents,PART I,Item 2. Management's Discussion and Analysis of Financial Condition and Results of Operations,discussion
2018-09-30T04:00:00Z,2018-11-08T05:00:00Z,10-Q,Quarterly report [Sections 13 or 15(d)],83,Consolidated Statement of Income,PART I,Item 2. Management's Discussion and Analysis of Financial Condition and Results of Operations,discussion
2018-09-30T04:00:00Z,2018-11-08T05:00:00Z,10-Q,Quarterly report [Sections 13 or 15(d)],83,Explanations of variations between periods for selected income statement categories are provided below:,PART I,Item 2. Management's Discussion and Analysis of Financial Condition and Results of Operations,discussion
2018-09-30T04:00:00Z,2018-11-08T05:00:00Z,10-Q,Quarterly report [Sections 13 or 15(d)],83,"Three Months Ended  September 30   Nine Months Ended  September 30   2018   2017   2018   2017   (Millions of dollars) Sales and other operating revenues $ 42,105     $ 33,892     $ 118,564     $ 98,293",PART I,Item 2. Management's Discussion and Analysis of Financial Condition and Results of Operations,discussion
2018-09-30T04:00:00Z,2018-11-08T05:00:00Z,10-Q,Quarterly report [Sections 13 or 15(d)],83,"Sales and other operating revenues increased $8.21 billion for the quarterly period mainly due to higher crude oil and refined product prices, partially offset by lower refined product sales volumes. Sales and other operating revenues increased $20.27 billion for the nine-month period mainly due to higher crude oil, refined product and natural gas prices, partially offset by lower refined product sales volumes.",PART I,Item 2. Management's Discussion and Analysis of Financial Condition and Results of Operations,discussion
2018-09-30T04:00:00Z,2018-11-08T05:00:00Z,10-Q,Quarterly report [Sections 13 or 15(d)],83,"Beginning in 2018, excise, value-added and similar taxes collected on behalf of third parties were no longer included in ""Sales and other operating revenues,"" but are netted in ""Taxes other than on income"" in accordance with ASU 2014-09. Third quarter 2017 includes $1.87 billion and the first nine months of 2017 include $5.32 billion in taxes collected on behalf of third parties.",PART I,Item 2. Management's Discussion and Analysis of Financial Condition and Results of Operations,discussion
2018-09-30T04:00:00Z,2018-11-08T05:00:00Z,10-Q,Quarterly report [Sections 13 or 15(d)],83,"Three Months Ended  September 30   Nine Months Ended  September 30   2018   2017   2018   2017   (Millions of dollars) Income from equity affiliates $ 1,555     $ 1,036     $ 4,685     $ 3,502",PART I,Item 2. Management's Discussion and Analysis of Financial Condition and Results of Operations,discussion
2018-09-30T04:00:00Z,2018-11-08T05:00:00Z,10-Q,Quarterly report [Sections 13 or 15(d)],83,"Income from equity affiliates in the quarterly period increased mainly due to higher upstream-related earnings from Tengizchevroil in Kazakhstan and Petropiar in Venezuela, and higher downstream-related earnings from CPChem, partially offset by lower downstream-related earnings from GS Caltex in South Korea. Income from equity affiliates in the nine-month period increased mainly due to higher upstream-related earnings from Tengizchevroil in Kazakhstan, Petroboscan and Petropiar in Venezuela, and higher downstream-related earnings from CPChem, partially offset by lower downstream-related earnings from GS Caltex in South Korea.",PART I,Item 2. Management's Discussion and Analysis of Financial Condition and Results of Operations,discussion
2018-09-30T04:00:00Z,2018-11-08T05:00:00Z,10-Q,Quarterly report [Sections 13 or 15(d)],83,"Three Months Ended  September 30   Nine Months Ended  September 30   2018   2017   2018   2017   (Millions of dollars) Other income $ 327     $ 1,277     $ 738     $ 2,311",PART I,Item 2. Management's Discussion and Analysis of Financial Condition and Results of Operations,discussion
2018-09-30T04:00:00Z,2018-11-08T05:00:00Z,10-Q,Quarterly report [Sections 13 or 15(d)],83,Other income for the quarterly period decreased due to lower gains on asset sales and an unfavorable swing in foreign currency effects. The nine-month period decreased due to lower gains on asset sales.,PART I,Item 2. Management's Discussion and Analysis of Financial Condition and Results of Operations,discussion
2018-09-30T04:00:00Z,2018-11-08T05:00:00Z,10-Q,Quarterly report [Sections 13 or 15(d)],83,"Three Months Ended  September 30   Nine Months Ended  September 30   2018   2017   2018   2017   (Millions of dollars) Purchased crude oil and products $ 24,681     $ 18,776     $ 70,658     $ 54,607",PART I,Item 2. Management's Discussion and Analysis of Financial Condition and Results of Operations,discussion
2018-09-30T04:00:00Z,2018-11-08T05:00:00Z,10-Q,Quarterly report [Sections 13 or 15(d)],83,"Purchases increased $5.91 billion for the quarterly period and $16.05 billion for the nine-month period primarily due to higher crude oil and refined product prices, partially offset by lower crude oil purchase volumes.",PART I,Item 2. Management's Discussion and Analysis of Financial Condition and Results of Operations,discussion
2018-09-30T04:00:00Z,2018-11-08T05:00:00Z,10-Q,Quarterly report [Sections 13 or 15(d)],83,"Three Months Ended  September 30   Nine Months Ended  September 30   2018   2017   2018   2017   (Millions of dollars) Operating, selling, general and  administrative expenses $ 6,003     $ 5,956     $ 17,657     $ 16,869",PART I,Item 2. Management's Discussion and Analysis of Financial Condition and Results of Operations,discussion
2018-09-30T04:00:00Z,2018-11-08T05:00:00Z,10-Q,Quarterly report [Sections 13 or 15(d)],83,"Operating, selling, general and administrative expenses increased $47 million between quarterly periods primarily due to a contractual settlement and higher transportation and materials and supplies expenses, partially offset by lower employee expenses.",PART I,Item 2. Management's Discussion and Analysis of Financial Condition and Results of Operations,discussion
2018-09-30T04:00:00Z,2018-11-08T05:00:00Z,10-Q,Quarterly report [Sections 13 or 15(d)],83,33,PART I,Item 2. Management's Discussion and Analysis of Financial Condition and Results of Operations,discussion
2018-09-30T04:00:00Z,2018-11-08T05:00:00Z,10-Q,Quarterly report [Sections 13 or 15(d)],83,Table of Contents,PART I,Item 2. Management's Discussion and Analysis of Financial Condition and Results of Operations,discussion
2018-09-30T04:00:00Z,2018-11-08T05:00:00Z,10-Q,Quarterly report [Sections 13 or 15(d)],83,"Expenses increased $788 million between nine-month periods primarily due to a receivable write-down, a contractual settlement, higher services and fees, and higher materials and supplies expenses.",PART I,Item 2. Management's Discussion and Analysis of Financial Condition and Results of Operations,discussion
2018-09-30T04:00:00Z,2018-11-08T05:00:00Z,10-Q,Quarterly report [Sections 13 or 15(d)],83,Three Months Ended  September 30   Nine Months Ended  September 30   2018   2017   2018   2017   (Millions of dollars) Exploration expenses $ 625     $ 239     $ 960     $ 508,PART I,Item 2. Management's Discussion and Analysis of Financial Condition and Results of Operations,discussion
2018-09-30T04:00:00Z,2018-11-08T05:00:00Z,10-Q,Quarterly report [Sections 13 or 15(d)],83,The increase in exploration expenses for both the quarterly and nine-month periods was primarily due to higher charges for well write-offs.,PART I,Item 2. Management's Discussion and Analysis of Financial Condition and Results of Operations,discussion
2018-09-30T04:00:00Z,2018-11-08T05:00:00Z,10-Q,Quarterly report [Sections 13 or 15(d)],83,"Three Months Ended  September 30   Nine Months Ended  September 30   2018   2017   2018   2017   (Millions of dollars) Depreciation, depletion and amortization $ 5,380     $ 5,109     $ 14,167     $ 14,614",PART I,Item 2. Management's Discussion and Analysis of Financial Condition and Results of Operations,discussion
2018-09-30T04:00:00Z,2018-11-08T05:00:00Z,10-Q,Quarterly report [Sections 13 or 15(d)],83,"Depreciation, depletion and amortization expenses in third quarter 2018 increased mainly due to higher production levels for certain oil and gas producing fields, an asset impairment, and higher write-offs, partially offset by lower depreciation rates for certain oil and gas producing fields and the absence of third quarter 2017 catch-up depreciation for Bangladesh operations. The nine-month period decreased mainly due to lower depreciation rates for certain oil and gas producing fields, lower impairment expenses, and the absence of third quarter 2017 catch-up depreciation for Bangladesh operations, partially offset by higher production levels for certain oil and gas producing fields.",PART I,Item 2. Management's Discussion and Analysis of Financial Condition and Results of Operations,discussion
2018-09-30T04:00:00Z,2018-11-08T05:00:00Z,10-Q,Quarterly report [Sections 13 or 15(d)],83,"Three Months Ended  September 30   Nine Months Ended  September 30   2018   2017   2018   2017   (Millions of dollars) Taxes other than on income $ 1,259     $ 3,213     $ 3,966     $ 9,149",PART I,Item 2. Management's Discussion and Analysis of Financial Condition and Results of Operations,discussion
2018-09-30T04:00:00Z,2018-11-08T05:00:00Z,10-Q,Quarterly report [Sections 13 or 15(d)],83,"Beginning in 2018, excise, value-added and similar taxes collected on behalf of third parties were netted in ""Taxes other than on income"" and were no longer included in ""Sales and other operating revenues,"" in accordance with ASU 2014-09. Third quarter 2017 includes $1.87 billion and the first nine months of 2017 include $5.32 billion in taxes collected on behalf of third parties. Partially offsetting the decrease in the quarterly and nine-month period were higher duties reflecting increased production.",PART I,Item 2. Management's Discussion and Analysis of Financial Condition and Results of Operations,discussion
2018-09-30T04:00:00Z,2018-11-08T05:00:00Z,10-Q,Quarterly report [Sections 13 or 15(d)],83,Three Months Ended  September 30   Nine Months Ended  September 30   2018   2017   2018   2017   (Millions of dollars) Interest and debt expense $ 182     $ 35     $ 558     $ 134,PART I,Item 2. Management's Discussion and Analysis of Financial Condition and Results of Operations,discussion
2018-09-30T04:00:00Z,2018-11-08T05:00:00Z,10-Q,Quarterly report [Sections 13 or 15(d)],83,Interest and debt expenses for the third quarter and the nine-month periods increased mainly due to a decrease in the amount of interest capitalized.,PART I,Item 2. Management's Discussion and Analysis of Financial Condition and Results of Operations,discussion
2018-09-30T04:00:00Z,2018-11-08T05:00:00Z,10-Q,Quarterly report [Sections 13 or 15(d)],83,Three Months Ended  September 30   Nine Months Ended  September 30   2018   2017   2018   2017   (Millions of dollars) Other components of net periodic benefit costs $ 158     $ 219     $ 344     $ 485,PART I,Item 2. Management's Discussion and Analysis of Financial Condition and Results of Operations,discussion
2018-09-30T04:00:00Z,2018-11-08T05:00:00Z,10-Q,Quarterly report [Sections 13 or 15(d)],83,"Other components of net periodic benefit costs for the third quarter and the nine-month periods decreased mainly due to a decrease in settlement losses, an increase in plan asset values and a decrease in amortization of actuarial losses. This line was added to the Consolidated Statement of Income in accordance with the adoption of ASU 2017-07.",PART I,Item 2. Management's Discussion and Analysis of Financial Condition and Results of Operations,discussion
2018-09-30T04:00:00Z,2018-11-08T05:00:00Z,10-Q,Quarterly report [Sections 13 or 15(d)],83,34,PART I,Item 2. Management's Discussion and Analysis of Financial Condition and Results of Operations,discussion
2018-09-30T04:00:00Z,2018-11-08T05:00:00Z,10-Q,Quarterly report [Sections 13 or 15(d)],83,Table of Contents,PART I,Item 2. Management's Discussion and Analysis of Financial Condition and Results of Operations,discussion
2018-09-30T04:00:00Z,2018-11-08T05:00:00Z,10-Q,Quarterly report [Sections 13 or 15(d)],83,"Three Months Ended  September 30   Nine Months Ended  September 30   2018   2017   2018   2017   (Millions of dollars) Income tax expense  $ 1,643     $ 672     $ 4,540     $ 1,589",PART I,Item 2. Management's Discussion and Analysis of Financial Condition and Results of Operations,discussion
2018-09-30T04:00:00Z,2018-11-08T05:00:00Z,10-Q,Quarterly report [Sections 13 or 15(d)],83,The increase in income tax expense between quarterly periods of $971 million is consistent with the increase in total income before tax for the company of $3.04 billion.,PART I,Item 2. Management's Discussion and Analysis of Financial Condition and Results of Operations,discussion
2018-09-30T04:00:00Z,2018-11-08T05:00:00Z,10-Q,Quarterly report [Sections 13 or 15(d)],83,"U.S. income before tax increased from a loss of $211 million in third quarter 2017 to income of $1.09 billion in 2018. This increase in income was primarily driven by the effect of higher crude oil prices and higher production. The increase in income had a direct impact on the company's U.S. income tax cost which was partially offset by the lower U.S. statutory tax rate. This resulted in an increase in tax expense of $543 million between year-over-year periods, from a tax benefit of $305 million in 2017 to a tax charge of $238 million in 2018.",PART I,Item 2. Management's Discussion and Analysis of Financial Condition and Results of Operations,discussion
2018-09-30T04:00:00Z,2018-11-08T05:00:00Z,10-Q,Quarterly report [Sections 13 or 15(d)],83,"International income before tax increased from $2.87 billion in third quarter 2017 to $4.61 billion in 2018. This $1.74 billion increase was primarily driven by the effect of higher crude oil prices and higher production. The increase in income primarily drove the $428 million increase in international income tax expense between year-over-year periods, from $977 million in 2017 to $1.41 billion in 2018.",PART I,Item 2. Management's Discussion and Analysis of Financial Condition and Results of Operations,discussion
2018-09-30T04:00:00Z,2018-11-08T05:00:00Z,10-Q,Quarterly report [Sections 13 or 15(d)],83,The increase in income tax expense for the first nine months of 2018 of $2.95 billion is consistent with the increase in total income before tax for the company of $7.94 billion.,PART I,Item 2. Management's Discussion and Analysis of Financial Condition and Results of Operations,discussion
2018-09-30T04:00:00Z,2018-11-08T05:00:00Z,10-Q,Quarterly report [Sections 13 or 15(d)],83,"U.S. income before tax for the first nine months increased from a loss of $66 million in 2017 to income of $3.00 billion in 2018. This increase in income was primarily driven by the effect of higher crude oil prices and higher production. The increase in income had a direct impact on the company's U.S. income tax cost, which was partially offset by the lower U.S. statutory tax rate. This resulted in an increase in tax expense of $1.26 billion between year-over-year periods, from a benefit of $549 million in 2017 to a tax charge of $712 million in 2018.",PART I,Item 2. Management's Discussion and Analysis of Financial Condition and Results of Operations,discussion
2018-09-30T04:00:00Z,2018-11-08T05:00:00Z,10-Q,Quarterly report [Sections 13 or 15(d)],83,"International income before tax for the first nine months increased from $7.81 billion in 2017 to $12.68 billion in 2018. This $4.87 billion increase was primarily driven by the effect of higher crude oil prices and higher production. The increase in income primarily drove the $1.69 billion increase in international income tax expense between year-over-year periods, from $2.14 billion in 2017 to $3.83 billion in 2018.",PART I,Item 2. Management's Discussion and Analysis of Financial Condition and Results of Operations,discussion
2018-09-30T04:00:00Z,2018-11-08T05:00:00Z,10-Q,Quarterly report [Sections 13 or 15(d)],83,Refer also to the discussion of the effective income tax rate in Note 12 on pages 15 and 16.,PART I,Item 2. Management's Discussion and Analysis of Financial Condition and Results of Operations,discussion
2018-09-30T04:00:00Z,2018-11-08T05:00:00Z,10-Q,Quarterly report [Sections 13 or 15(d)],83,35,PART I,Item 2. Management's Discussion and Analysis of Financial Condition and Results of Operations,discussion
2018-09-30T04:00:00Z,2018-11-08T05:00:00Z,10-Q,Quarterly report [Sections 13 or 15(d)],83,Table of Contents,PART I,Item 2. Management's Discussion and Analysis of Financial Condition and Results of Operations,discussion
2018-09-30T04:00:00Z,2018-11-08T05:00:00Z,10-Q,Quarterly report [Sections 13 or 15(d)],83,Selected Operating Data,PART I,Item 2. Management's Discussion and Analysis of Financial Condition and Results of Operations,discussion
2018-09-30T04:00:00Z,2018-11-08T05:00:00Z,10-Q,Quarterly report [Sections 13 or 15(d)],83,The following table presents a comparison of selected operating data:,PART I,Item 2. Management's Discussion and Analysis of Financial Condition and Results of Operations,discussion
2018-09-30T04:00:00Z,2018-11-08T05:00:00Z,10-Q,Quarterly report [Sections 13 or 15(d)],83,"Selected Operating Data (1) (2)  Three Months Ended  September 30   Nine Months Ended  September 30   2018   2017   2018   2017 U.S. Upstream               Net crude oil and natural gas liquids production (MBPD) 654     525     599     520   Net natural gas production (MMCFPD)(3) 1,061     932     1,011     988   Net oil-equivalent production (MBOEPD) 831     681     768     684   Sales of natural gas (MMCFPD) 3,334     3,455     3,343     3,288   Sales of natural gas liquids (MBPD) 114     37     110     34   Revenue from net production               Liquids ($/Bbl) $ 61.99     $ 41.83     $ 59.13     $ 42.65   Natural gas ($/MCF) $ 1.80     $ 1.80     $ 1.81     $ 2.17   International Upstream               Net crude oil and natural gas liquids production (MBPD)(4) 1,133     1,194     1,155     1,206   Net natural gas production (MMCFPD)(3) 5,951     5,053     5,731     5,001   Net oil-equivalent production (MBOEPD)(4) 2,125     2,036     2,110     2,040   Sales of natural gas (MMCFPD) 5,681     4,978     5,379     5,018   Sales of natural gas liquids (MBPD) 32     28     34     29   Revenue from liftings               Liquids ($/Bbl) $ 68.73     $ 47.81     $ 65.85     $ 47.07   Natural gas ($/MCF) $ 6.73     $ 4.76     $ 6.10     $ 4.50   U.S. and International Upstream               Total net oil-equivalent production (MBOEPD)(4) 2,956     2,717     2,878     2,724   U.S. Downstream               Gasoline sales (MBPD)(5) 644     649     629     629   Other refined product sales (MBPD) 590     576     591     577   Total refined product sales (MBPD) 1,234     1,225     1,220     1,206   Sales of natural gas liquids (MBPD) 74     100     68     108   Refinery input (MBPD) 915     931     900     924   International Downstream               Gasoline sales (MBPD)(5) 301     352     310     339   Other refined product sales (MBPD) 766     835     770     785   Share of affiliate sales (MBPD) 368     369     369     360   Total refined product sales (MBPD) 1,435     1,556     1,449     1,484   Sales of natural gas liquids (MBPD) 64     62     62     65   Refinery input (MBPD)(6) 710     801     721     760   ________________________________               (1)  Includes company share of equity affiliates.               (2)  MBPD  -  thousands of barrels per day; MMCFPD  -  millions of cubic feet per day; Bbl  -  Barrel; MCF  -  thousands of cubic feet; oil-equivalent gas conversion ratio is 6,000 cubic feet of natural gas = 1 barrel of crude oil; MBOEPD  -  thousands of barrels of oil-equivalent per day. (3)  Includes natural gas consumed in operations (MMCFPD):             United States 34     34     34     37   International 567     545     569     523   (4)  Includes net production of synthetic oil:               Canada 54     56     53     52   Venezuela affiliate 24     29     24     29   (5)  Includes branded and unbranded gasoline.               (6)  In third quarter 2017, the company sold the Burnaby Refinery in British Columbia, Canada, which included operable capacity of  55,000 barrels per day.",PART I,Item 2. Management's Discussion and Analysis of Financial Condition and Results of Operations,discussion
2018-09-30T04:00:00Z,2018-11-08T05:00:00Z,10-Q,Quarterly report [Sections 13 or 15(d)],83,36,PART I,Item 2. Management's Discussion and Analysis of Financial Condition and Results of Operations,discussion
2018-09-30T04:00:00Z,2018-11-08T05:00:00Z,10-Q,Quarterly report [Sections 13 or 15(d)],83,Table of Contents,PART I,Item 2. Management's Discussion and Analysis of Financial Condition and Results of Operations,discussion
2018-09-30T04:00:00Z,2018-11-08T05:00:00Z,10-Q,Quarterly report [Sections 13 or 15(d)],83,Liquidity and Capital Resources,PART I,Item 2. Management's Discussion and Analysis of Financial Condition and Results of Operations,discussion
2018-09-30T04:00:00Z,2018-11-08T05:00:00Z,10-Q,Quarterly report [Sections 13 or 15(d)],83,"Cash, cash equivalents and marketable securities totaled $9.7 billion at September 30, 2018 and $4.8 billion at year-end 2017. Cash provided by operating activities in the first nine months of 2018 was $21.5 billion, compared with $14.2 billion in the year-ago period, reflecting higher prices and production, partially offset by higher working capital requirements in the current period. Cash capital and exploratory expenditures totaled $10.2 billion in the first nine months of 2018, up $96 million from the year-ago period. Proceeds and deposits related to asset sales and returns of investment totaled $1.9 billion and $244 million, respectively in the first nine months of 2018, compared to $4.6 billion and $162 million, respectively in the year ago period.",PART I,Item 2. Management's Discussion and Analysis of Financial Condition and Results of Operations,discussion
2018-09-30T04:00:00Z,2018-11-08T05:00:00Z,10-Q,Quarterly report [Sections 13 or 15(d)],83,"Dividends The company paid dividends of $6.4 billion to common stockholders during the first nine months of 2018. In October 2018, the company declared a quarterly dividend of $1.12 per common share, payable in December 2018.",PART I,Item 2. Management's Discussion and Analysis of Financial Condition and Results of Operations,discussion
2018-09-30T04:00:00Z,2018-11-08T05:00:00Z,10-Q,Quarterly report [Sections 13 or 15(d)],83,"Debt and Capital Lease Obligations Chevron's total debt and capital lease obligations were $36.1 billion at September 30, 2018, down from $38.8 billion at December 31, 2017.",PART I,Item 2. Management's Discussion and Analysis of Financial Condition and Results of Operations,discussion
2018-09-30T04:00:00Z,2018-11-08T05:00:00Z,10-Q,Quarterly report [Sections 13 or 15(d)],83,"The company's primary financing source for working capital needs is its commercial paper program. The outstanding balance for the company's commercial paper program at September 30, 2018 was $7.3 billion. The company's debt and capital lease obligations due within one year, consisting primarily of commercial paper, redeemable long-term obligations and the current portion of long-term debt, totaled $16.1 billion at September 30, 2018, and $15.2 billion at December 31, 2017. Of these amounts, $10.0 billion was reclassified to long-term at both September 30, 2018, and December 31, 2017. At September 30, 2018, settlement of these obligations was not expected to require the use of working capital within one year, as the company had the intent and the ability, as evidenced by committed credit facilities, to refinance them on a long-term basis.",PART I,Item 2. Management's Discussion and Analysis of Financial Condition and Results of Operations,discussion
