period_date,filing_date,type,form_name,documents,text,part.name,item.name,section
2019-06-30T04:00:00Z,2019-08-07T04:00:00Z,10-Q,Quarterly report [Sections 13 or 15(d)],84,"In contrast to price movements in the global market for crude oil, price changes for natural gas are more closely aligned with seasonal supply-and-demand and infrastructure conditions in local markets. In the United States, prices at Henry Hub averaged $2.73 per thousand cubic feet (MCF) for the first six months of 2019, compared with $2.92 during the first six months of 2018. At the end of July 2019, the Henry Hub spot price was $2.23 per MCF. Increased production in the Permian Basin has resulted in insufficient gas pipeline and fractionation capacity in the near-term, leading to depressed natural gas and natural gas liquids prices in West Texas. A sizable portion of Chevron's U.S. natural gas production comes from the Permian Basin, resulting in natural gas realizations that are significantly lower than the Henry Hub price.",PART I,Item 2. Management's Discussion and Analysis of Financial Condition and Results of Operations,discussion
2019-06-30T04:00:00Z,2019-08-07T04:00:00Z,10-Q,Quarterly report [Sections 13 or 15(d)],84,"Outside the United States, price changes for natural gas depend on a wide range of supply, demand and regulatory circumstances. Chevron sells natural gas into the domestic pipeline market in most locations. In some locations, Chevron has invested in long-term projects to produce and liquefy natural gas for transport by tanker to other markets. The company's long-term contract prices for liquefied natural gas (LNG) are typically linked to crude oil prices. Most of the equity LNG offtake from the operated Australian LNG projects is committed under binding long-term contracts, with the remainder to be sold in the Asian spot LNG market.  The Asian spot market reflects the supply and demand for LNG in the Pacific Basin and is not directly linked to crude oil prices. International natural gas sales realizations averaged $6.00 per MCF during the first six months of 2019, compared with $5.75 per MCF in the same period last year. (See page 36 for the company's average natural gas sales prices for the U.S. and international regions.)",PART I,Item 2. Management's Discussion and Analysis of Financial Condition and Results of Operations,discussion
2019-06-30T04:00:00Z,2019-08-07T04:00:00Z,10-Q,Quarterly report [Sections 13 or 15(d)],84,28,PART I,Item 2. Management's Discussion and Analysis of Financial Condition and Results of Operations,discussion
2019-06-30T04:00:00Z,2019-08-07T04:00:00Z,10-Q,Quarterly report [Sections 13 or 15(d)],84,Table of Contents,PART I,Item 2. Management's Discussion and Analysis of Financial Condition and Results of Operations,discussion
2019-06-30T04:00:00Z,2019-08-07T04:00:00Z,10-Q,Quarterly report [Sections 13 or 15(d)],84,"The company's worldwide net oil-equivalent production in the first six months of 2019 averaged 3.061 million barrels per day, 8 percent higher than the year-ago period. About one-sixth of the company's net oil-equivalent production in the first six months of 2019 occurred in the OPEC-member countries of Angola, Nigeria, Republic of Congo and Venezuela. OPEC quotas had no effect on the company's net crude oil production for the second quarter of 2019 or 2018.",PART I,Item 2. Management's Discussion and Analysis of Financial Condition and Results of Operations,discussion
2019-06-30T04:00:00Z,2019-08-07T04:00:00Z,10-Q,Quarterly report [Sections 13 or 15(d)],84,"The company estimates that net oil-equivalent production in 2019 will grow 4 to 7 percent compared to 2018, assuming a Brent crude oil price of $60 per barrel and excluding the impact of 2019 asset sales. This estimate is subject to many factors and uncertainties, including quotas or other actions that may be imposed by OPEC; price effects on entitlement volumes; changes in fiscal terms or restrictions on the scope of company operations; delays in construction; reservoir performance; greater-than-expected declines in production from mature fields; start-up or ramp-up of projects; fluctuations in demand for natural gas in various markets; weather conditions that may shut in production; civil unrest; changing geopolitics; delays in completion of maintenance turnarounds; or other disruptions to operations. The outlook for future production levels is also affected by the size and number of economic investment opportunities and the time lag between initial exploration and the beginning of production. The company has increased its investment emphasis on short-cycle projects.",PART I,Item 2. Management's Discussion and Analysis of Financial Condition and Results of Operations,discussion
2019-06-30T04:00:00Z,2019-08-07T04:00:00Z,10-Q,Quarterly report [Sections 13 or 15(d)],84,"In the Partitioned Zone between Saudi Arabia and Kuwait, production was shut-in beginning in May 2015 as a result of difficulties in securing work and equipment permits. Net oil-equivalent production in the Partitioned Zone in 2014 was 81,000 barrels per day. As of early August 2019, production remained shut-in, and the exact timing of a production restart is uncertain and dependent on dispute resolution between Saudi Arabia and Kuwait. The financial effects from the loss of Partitioned Zone production have not been significant.",PART I,Item 2. Management's Discussion and Analysis of Financial Condition and Results of Operations,discussion
2019-06-30T04:00:00Z,2019-08-07T04:00:00Z,10-Q,Quarterly report [Sections 13 or 15(d)],84,"Chevron has interests in Venezuelan crude oil production assets, including those operated by independent equity affiliates. Refer to Note 13 on page 22 under the heading ""Other Contingencies"" for more information on the company's activities in Venezuela.",PART I,Item 2. Management's Discussion and Analysis of Financial Condition and Results of Operations,discussion
2019-06-30T04:00:00Z,2019-08-07T04:00:00Z,10-Q,Quarterly report [Sections 13 or 15(d)],84,"Refer to the ""Results of Operations"" section on pages 30 and 31 for additional discussion of the company's upstream business.",PART I,Item 2. Management's Discussion and Analysis of Financial Condition and Results of Operations,discussion
2019-06-30T04:00:00Z,2019-08-07T04:00:00Z,10-Q,Quarterly report [Sections 13 or 15(d)],84,"Downstream Earnings for the downstream segment are closely tied to margins on the refining, manufacturing and marketing of products that include gasoline, diesel, jet fuel, lubricants, fuel oil, fuel and lubricant additives, and petrochemicals. Industry margins are sometimes volatile and can be affected by the global and regional supply-and-demand balance for refined products and petrochemicals, and by changes in the price of crude oil, other refinery and petrochemical feedstocks, and natural gas. Industry margins can also be influenced by inventory levels, geopolitical events, costs of materials and services, refinery or chemical plant capacity utilization, maintenance programs, and disruptions at refineries or chemical plants resulting from unplanned outages due to severe weather, fires or other operational events.",PART I,Item 2. Management's Discussion and Analysis of Financial Condition and Results of Operations,discussion
2019-06-30T04:00:00Z,2019-08-07T04:00:00Z,10-Q,Quarterly report [Sections 13 or 15(d)],84,"Other factors affecting profitability for downstream operations include the reliability and efficiency of the company's refining, marketing and petrochemical assets, the effectiveness of its crude oil and product supply functions, and the volatility of tanker-charter rates for the company's shipping operations, which are driven by the industry's demand for crude oil and product tankers. Other factors beyond the company's control include the general level of inflation and energy costs to operate the company's refining, marketing and petrochemical assets, and changes in tax laws and regulations.",PART I,Item 2. Management's Discussion and Analysis of Financial Condition and Results of Operations,discussion
2019-06-30T04:00:00Z,2019-08-07T04:00:00Z,10-Q,Quarterly report [Sections 13 or 15(d)],84,The company's most significant marketing areas are the West Coast and Gulf Coast of the United States and Asia. Chevron operates or has significant ownership interests in refineries in each of these areas.,PART I,Item 2. Management's Discussion and Analysis of Financial Condition and Results of Operations,discussion
2019-06-30T04:00:00Z,2019-08-07T04:00:00Z,10-Q,Quarterly report [Sections 13 or 15(d)],84,"Refer to the ""Results of Operations"" section on pages 31 and 32 for additional discussion of the company's downstream operations.",PART I,Item 2. Management's Discussion and Analysis of Financial Condition and Results of Operations,discussion
2019-06-30T04:00:00Z,2019-08-07T04:00:00Z,10-Q,Quarterly report [Sections 13 or 15(d)],84,"All Other consists of worldwide cash management and debt financing activities, corporate administrative functions, insurance operations, real estate activities and technology companies.",PART I,Item 2. Management's Discussion and Analysis of Financial Condition and Results of Operations,discussion
2019-06-30T04:00:00Z,2019-08-07T04:00:00Z,10-Q,Quarterly report [Sections 13 or 15(d)],84,29,PART I,Item 2. Management's Discussion and Analysis of Financial Condition and Results of Operations,discussion
2019-06-30T04:00:00Z,2019-08-07T04:00:00Z,10-Q,Quarterly report [Sections 13 or 15(d)],84,Table of Contents,PART I,Item 2. Management's Discussion and Analysis of Financial Condition and Results of Operations,discussion
2019-06-30T04:00:00Z,2019-08-07T04:00:00Z,10-Q,Quarterly report [Sections 13 or 15(d)],84,Operating Developments,PART I,Item 2. Management's Discussion and Analysis of Financial Condition and Results of Operations,discussion
2019-06-30T04:00:00Z,2019-08-07T04:00:00Z,10-Q,Quarterly report [Sections 13 or 15(d)],84,Noteworthy operating developments in recent months included the following:,PART I,Item 2. Management's Discussion and Analysis of Financial Condition and Results of Operations,discussion
2019-06-30T04:00:00Z,2019-08-07T04:00:00Z,10-Q,Quarterly report [Sections 13 or 15(d)],84,• Denmark  -  Completed the sale of upstream interests in early April.,PART I,Item 2. Management's Discussion and Analysis of Financial Condition and Results of Operations,discussion
2019-06-30T04:00:00Z,2019-08-07T04:00:00Z,10-Q,Quarterly report [Sections 13 or 15(d)],84,"• United States  -  In early May, the company completed the acquisition of a refinery in Pasadena, Texas.",PART I,Item 2. Management's Discussion and Analysis of Financial Condition and Results of Operations,discussion
2019-06-30T04:00:00Z,2019-08-07T04:00:00Z,10-Q,Quarterly report [Sections 13 or 15(d)],84,The company purchased $1.0 billion of its common stock in second quarter 2019 under its share repurchase program.,PART I,Item 2. Management's Discussion and Analysis of Financial Condition and Results of Operations,discussion
2019-06-30T04:00:00Z,2019-08-07T04:00:00Z,10-Q,Quarterly report [Sections 13 or 15(d)],84,Results of Operations,PART I,Item 2. Management's Discussion and Analysis of Financial Condition and Results of Operations,discussion
2019-06-30T04:00:00Z,2019-08-07T04:00:00Z,10-Q,Quarterly report [Sections 13 or 15(d)],84,"Business Segments The following section presents the results of operations and variances on an after-tax basis for the company's business segments  -  Upstream and Downstream  -  as well as for ""All Other."" (Refer to Note 8, beginning on page 11, for a discussion of the company's ""reportable segments,"" as defined under the accounting standards for segment reporting.)",PART I,Item 2. Management's Discussion and Analysis of Financial Condition and Results of Operations,discussion
2019-06-30T04:00:00Z,2019-08-07T04:00:00Z,10-Q,Quarterly report [Sections 13 or 15(d)],84,Upstream,PART I,Item 2. Management's Discussion and Analysis of Financial Condition and Results of Operations,discussion
2019-06-30T04:00:00Z,2019-08-07T04:00:00Z,10-Q,Quarterly report [Sections 13 or 15(d)],84,"Three Months Ended  June 30   Six Months Ended  June 30   2019   2018   2019   2018   (Millions of dollars) U.S. Upstream Earnings $ 896     $ 838     $ 1,644     $ 1,486",PART I,Item 2. Management's Discussion and Analysis of Financial Condition and Results of Operations,discussion
2019-06-30T04:00:00Z,2019-08-07T04:00:00Z,10-Q,Quarterly report [Sections 13 or 15(d)],84,"U.S. upstream operations earned $896 million in second quarter 2019, compared with $838 million from a year earlier. The improvement primarily reflected higher crude oil production of $470 million, partially offset by lower crude oil and natural gas prices of $230 million and $70 million, respectively, higher operating and depreciation expenses primarily related to increased Permian Basin activity of $40 million and $30 million, respectively, and higher tax items of $30 million.",PART I,Item 2. Management's Discussion and Analysis of Financial Condition and Results of Operations,discussion
2019-06-30T04:00:00Z,2019-08-07T04:00:00Z,10-Q,Quarterly report [Sections 13 or 15(d)],84,"U.S. upstream earned $1.64 billion for the first six months of 2019, compared with earnings of $1.49 billion from a year earlier. The improvement primarily reflected higher crude oil production of $870 million, partially offset by lower crude oil and natural gas prices of $520 million and $100 million, respectively, and higher operating expenses of $130 million primarily related to increased Permian Basin activity.",PART I,Item 2. Management's Discussion and Analysis of Financial Condition and Results of Operations,discussion
2019-06-30T04:00:00Z,2019-08-07T04:00:00Z,10-Q,Quarterly report [Sections 13 or 15(d)],84,"The company's average realization per barrel for U.S. crude oil and natural gas liquids was $52 in second quarter 2019, down from $59 a year earlier. The average six-month realization per barrel for U.S. crude oil and natural gas liquids was $50 in 2019, compared to $57 a year earlier. The average natural gas realization in second quarter 2019 was $0.68 per thousand cubic feet, compared with $1.61 in second quarter 2018. The average six-month natural gas realization was $1.17 per thousand cubic feet in 2019 and $1.81 in 2018.",PART I,Item 2. Management's Discussion and Analysis of Financial Condition and Results of Operations,discussion
2019-06-30T04:00:00Z,2019-08-07T04:00:00Z,10-Q,Quarterly report [Sections 13 or 15(d)],84,"Net oil-equivalent production of 898,000 barrels per day in second quarter 2019 was up 159,000 barrels per day, or 22 percent, from a year earlier. Production increases from shale and tight properties in the Permian Basin in Texas and New Mexico, and base business in the Gulf of Mexico, were partially offset by normal field declines. Net oil-equivalent production of 891,000 barrels per day in the first six months of 2019 was up 155,000 barrels per day, or 21 percent, from a year earlier. The production increase was largely due to shale and tight properties in the Permian Basin in Texas and New Mexico.",PART I,Item 2. Management's Discussion and Analysis of Financial Condition and Results of Operations,discussion
2019-06-30T04:00:00Z,2019-08-07T04:00:00Z,10-Q,Quarterly report [Sections 13 or 15(d)],84,"The net liquids component of oil-equivalent production of 710,000 barrels per day in second quarter 2019 was up 23 percent from the corresponding 2018 period. The net liquids component of oil-equivalent production of 700,000 barrels per day in the 2019 six-month period was up 23 percent from the 2018 period. Net natural gas production was 1.13 billion cubic feet per day in second quarter 2019, an increase of 15 percent from the 2018 comparative period. Net natural gas production was 1.15 billion cubic feet per day in the first six months of 2018, an increase of 16 percent from the 2018 period.",PART I,Item 2. Management's Discussion and Analysis of Financial Condition and Results of Operations,discussion
2019-06-30T04:00:00Z,2019-08-07T04:00:00Z,10-Q,Quarterly report [Sections 13 or 15(d)],84,30,PART I,Item 2. Management's Discussion and Analysis of Financial Condition and Results of Operations,discussion
2019-06-30T04:00:00Z,2019-08-07T04:00:00Z,10-Q,Quarterly report [Sections 13 or 15(d)],84,Table of Contents,PART I,Item 2. Management's Discussion and Analysis of Financial Condition and Results of Operations,discussion
2019-06-30T04:00:00Z,2019-08-07T04:00:00Z,10-Q,Quarterly report [Sections 13 or 15(d)],84,"Three Months Ended  June 30   Six Months Ended  June 30   2019   2018   2019   2018   (Millions of dollars) International Upstream Earnings* $ 2,587     $ 2,457     $ 4,962     $ 5,161   _______________________               *  Includes foreign currency effects $ 22     $ 217     $ (146 )   $ 337",PART I,Item 2. Management's Discussion and Analysis of Financial Condition and Results of Operations,discussion
2019-06-30T04:00:00Z,2019-08-07T04:00:00Z,10-Q,Quarterly report [Sections 13 or 15(d)],84,"International upstream operations earned $2.59 billion in second quarter 2019, compared with $2.46 billion a year ago. The increase in earnings was mostly due to higher natural gas sales volumes of $340 million, tax benefits of $230 million, mostly associated with a reduction in the Alberta, Canada corporate income tax rate, lower operating expenses of $200 million, and higher gains on asset sales of $80 million. Partially offsetting these effects were lower crude oil and natural gas realization of $270 million and $240 million, respectively. Foreign currency effects had an unfavorable impact on earnings of $195 million between periods.",PART I,Item 2. Management's Discussion and Analysis of Financial Condition and Results of Operations,discussion
2019-06-30T04:00:00Z,2019-08-07T04:00:00Z,10-Q,Quarterly report [Sections 13 or 15(d)],84,"Earnings for the first six months of 2019 were $4.96 billion, compared with $5.16 billion from a year earlier. Higher natural gas sales volumes of $470 million, lower operating expenses of $200 million and tax benefits of $170 million, mostly associated with a reduction in the Alberta, Canada corporate income tax rate, were partially offset by lower crude oil realizations of $500 million. Foreign currency effects had an unfavorable impact on earnings of $483 million between periods.",PART I,Item 2. Management's Discussion and Analysis of Financial Condition and Results of Operations,discussion
2019-06-30T04:00:00Z,2019-08-07T04:00:00Z,10-Q,Quarterly report [Sections 13 or 15(d)],84,"The average realization per barrel of crude oil and natural gas liquids in second quarter 2019 was $62, compared with $68 a year earlier. The average realization per barrel of crude oil and natural gas liquids in the first six months of 2019 was $60, compared with $64 a year earlier. The average natural gas realization in second quarter 2019 was $5.43 per thousand cubic feet, compared with $5.64 in the 2018 period. The average natural gas realization in the first six months of 2019 was $6.00 per thousand cubic feet, compared with $5.75 in the 2018 period.",PART I,Item 2. Management's Discussion and Analysis of Financial Condition and Results of Operations,discussion
2019-06-30T04:00:00Z,2019-08-07T04:00:00Z,10-Q,Quarterly report [Sections 13 or 15(d)],84,"International net oil-equivalent production of 2.19 million barrels per day in second quarter 2019 was up 99,000 barrels per day, or 5 percent, from the corresponding 2018 period. Production increases from Wheatstone and other major capital projects, base business, and shale and tight properties, were partially offset by normal field declines and the effect of asset sales.",PART I,Item 2. Management's Discussion and Analysis of Financial Condition and Results of Operations,discussion
2019-06-30T04:00:00Z,2019-08-07T04:00:00Z,10-Q,Quarterly report [Sections 13 or 15(d)],84,"International net oil-equivalent production of 2.17 million barrels per day in the first six months of 2019 was up 67,000 barrels per day, or 3 percent, from a year earlier. Production increases from Wheatstone and other major capital projects, and base business, were partially offset by normal field declines.",PART I,Item 2. Management's Discussion and Analysis of Financial Condition and Results of Operations,discussion
2019-06-30T04:00:00Z,2019-08-07T04:00:00Z,10-Q,Quarterly report [Sections 13 or 15(d)],84,The net liquids component of oil-equivalent production of 1.15 million barrels per day in second quarter 2019 was unchanged from the 2018 period. The net liquids component of oil-equivalent production of 1.17 million barrels per day in the first six months of 2019 was unchanged from the 2018 period. Net natural gas production of 6.20 billion cubic feet per day in second quarter 2019 increased 10 percent from the 2018 period. Net natural gas production of 6.01 billion cubic feet per day in the first six months of 2019 increased 7 percent from the 2018 period.,PART I,Item 2. Management's Discussion and Analysis of Financial Condition and Results of Operations,discussion
2019-06-30T04:00:00Z,2019-08-07T04:00:00Z,10-Q,Quarterly report [Sections 13 or 15(d)],84,Downstream,PART I,Item 2. Management's Discussion and Analysis of Financial Condition and Results of Operations,discussion
2019-06-30T04:00:00Z,2019-08-07T04:00:00Z,10-Q,Quarterly report [Sections 13 or 15(d)],84,"Three Months Ended  June 30   Six Months Ended  June 30   2019   2018   2019   2018   (Millions of dollars) U.S. Downstream Earnings $ 465     $ 657     $ 682     $ 1,099",PART I,Item 2. Management's Discussion and Analysis of Financial Condition and Results of Operations,discussion
2019-06-30T04:00:00Z,2019-08-07T04:00:00Z,10-Q,Quarterly report [Sections 13 or 15(d)],84,"U.S. downstream operations earned $465 million in second quarter 2019, compared with earnings of $657 million a year earlier. The decrease was primarily due to lower margins on refined product sales of $90 million and lower equity earnings of $40 million from CPChem.",PART I,Item 2. Management's Discussion and Analysis of Financial Condition and Results of Operations,discussion
2019-06-30T04:00:00Z,2019-08-07T04:00:00Z,10-Q,Quarterly report [Sections 13 or 15(d)],84,"Earnings for the first six months of 2019 were $682 million, compared with earnings of $1.10 billion a year earlier. The decrease was primarily due to lower margins on refined product sales of $280 million and lower equity earnings from the 50 percent-owned CPChem of $100 million.",PART I,Item 2. Management's Discussion and Analysis of Financial Condition and Results of Operations,discussion
2019-06-30T04:00:00Z,2019-08-07T04:00:00Z,10-Q,Quarterly report [Sections 13 or 15(d)],84,31,PART I,Item 2. Management's Discussion and Analysis of Financial Condition and Results of Operations,discussion
2019-06-30T04:00:00Z,2019-08-07T04:00:00Z,10-Q,Quarterly report [Sections 13 or 15(d)],84,Table of Contents,PART I,Item 2. Management's Discussion and Analysis of Financial Condition and Results of Operations,discussion
2019-06-30T04:00:00Z,2019-08-07T04:00:00Z,10-Q,Quarterly report [Sections 13 or 15(d)],84,"Refinery crude oil input in second quarter 2019 increased 12 percent from the year-ago period to 960,000 barrels per day, primarily due to the absence of second quarter 2018 planned turnaround activity and the purchase of the Pasadena refinery in Texas. For the first six months of 2019, crude oil input was 911,000 barrels per day, up 2 percent from the corresponding 2018 period. Refined product sales of 1.28 million barrels per day were up 3 percent from second quarter 2018. Refined product sales of 1.24 million barrels per day in the six-month period were up 2 percent from the first six months of 2018.",PART I,Item 2. Management's Discussion and Analysis of Financial Condition and Results of Operations,discussion
2019-06-30T04:00:00Z,2019-08-07T04:00:00Z,10-Q,Quarterly report [Sections 13 or 15(d)],84,Three Months Ended  June 30   Six Months Ended  June 30   2019   2018   2019   2018   (Millions of dollars) International Downstream Earnings* $ 264     $ 181     $ 299     $ 467   _______________________               *  Includes foreign currency effects $ (9 )   $ 44     $ 22     $ 55,PART I,Item 2. Management's Discussion and Analysis of Financial Condition and Results of Operations,discussion
2019-06-30T04:00:00Z,2019-08-07T04:00:00Z,10-Q,Quarterly report [Sections 13 or 15(d)],84,"International downstream operations earned $264 million in second quarter 2019, compared with $181 million a year earlier. The increase in earnings was largely due to higher margins on refined product sales of  $50 million and a post-close working capital adjustment related to the 2018 sale of the Cape Town refinery in South Africa of $40 million. Foreign currency effects had an unfavorable impact on earnings of $53 million between periods.",PART I,Item 2. Management's Discussion and Analysis of Financial Condition and Results of Operations,discussion
2019-06-30T04:00:00Z,2019-08-07T04:00:00Z,10-Q,Quarterly report [Sections 13 or 15(d)],84,"Earnings for the first six months of 2019 were $299 million, compared with $467 million a year earlier. The decrease in earnings was largely due to lower margins on refined product sales of $270 million, partially offset by a post-close working capital adjustment of the 2018 sale of the Cape Town refinery in South Africa of $40 million. Foreign currency effects had a unfavorable impact on earnings of $33 million between periods.",PART I,Item 2. Management's Discussion and Analysis of Financial Condition and Results of Operations,discussion
